{
    "$schema": "../user_schema.json",
    "uuid": "da4cfd8d-f522-4816-8615-f71be48971c9",
    "updated": "2019-10-12T07:20:50.52Z",
    "created": "2019-10-12T07:20:50.52Z",
    "name": "Contracter name",
    "user_type": "contractor",
    "contact": {
        "email": "collin_blosser@yahoo.com",
        "tel": null,
        "website": null
    }
}